{
	"schemaVersion": 5,
	"id": "pathfinder",
	"designDisplayName": "Pathfinder class",
	"maximumTacticalSpeedKilometersPerSecond": 10,
	"passiveSensorRangeKilometers": 30.0,
	"activeScanDurationMilliseconds": 2000,
	"engineering": {
		"nominalGenerationPowerUnits": 120,
		"nominalSensorDemandPowerUnits": 70,
		"nominalImpulseDemandPowerUnits": 50,
		"sensorRepairDurationMilliseconds": 8000,
		"impulseRepairDurationMilliseconds": 6000,
		"nominalShieldDemandPowerUnits": 40,
		"nominalDirectedEnergyDemandPowerUnits": 30,
		"shieldRepairDurationMilliseconds": 8000,
		"directedEnergyRepairDurationMilliseconds": 6000
	},
	"directedEnergyWeapon": {
		"rangeKilometers": 20,
		"baseNormalizedDamage": 0.25,
		"cooldownMilliseconds": 2000
	}
}
